{
  "blocked_extension_targets": [
    "protocol.request.headers.authorization"
  ],
  "commercial_tier_limit": null,
  "evidence": [
    {
      "locator": "repository-configured max_output_tokens; not an official provider maximum",
      "source": "migrations 0034 and 0040"
    }
  ],
  "identity": {
    "canonical_hash": "sha256:f921c95694b8b47391fa50602f5ae8034e626fea86ec652fe17bb75175d38285",
    "key": "kimi-k2-5-draft-output-safety",
    "kind": "platform-safety-policy",
    "revision": "1"
  },
  "platform_ceiling": 32768,
  "platform_ceiling_enforceable": true,
  "platform_ceiling_verified": true,
  "policy_keys": [
    "draft-only",
    "legacy-output-ceiling"
  ],
  "provider_maximum": null,
  "provider_maximum_verified": false,
  "schema_version": "1"
}
